{
  "meta": {
    "product": "EcoVoorscan",
    "version": "1.0.0",
    "generated": "2025-05-15T10:00:00Z",
    "purpose": "Design reasoning for a Dutch sustainability assessment platform used by construction professionals and ecology consultants to evaluate environmental risk in construction projects.",
    "schema_version": "1.0.0"
  },
  "nodes": {
    "intents": {
      "INT-001": {
        "id": "INT-001",
        "label": "Risk Assessment Review",
        "short": "Risk review",
        "description": "Construction professionals need to immediately see overall project risk and drill into specific risk categories to make go/no-go decisions.",
        "connects_to": ["PSY-001", "PSY-002", "EMO-001", "CUL-001"],
        "principle": "Risk visibility drives informed decision-making under time pressure",
        "implication": "Overall risk score must be visible within 2 seconds of opening a project",
        "phase": "active-use",
        "rule": "Risk score is the first element in the visual hierarchy on every project page"
      },
      "INT-002": {
        "id": "INT-002",
        "label": "Project Comparison",
        "short": "Compare projects",
        "description": "Compare risk profiles across multiple construction sites to prioritize which projects need immediate attention during weekly planning.",
        "connects_to": ["PSY-003", "PSY-001", "CUL-002"],
        "principle": "Comparison requires consistent visual encoding across items",
        "implication": "All project cards must use identical layout, scale, and color mapping",
        "phase": "active-use"
      },
      "INT-003": {
        "id": "INT-003",
        "label": "Report Generation",
        "short": "Generate reports",
        "description": "Generate PDF reports conforming to Dutch environmental reporting standards for regulatory submission.",
        "connects_to": ["PSY-004", "CUL-003", "AUD-002"],
        "principle": "Regulatory output must be predictable and inspectable before submission",
        "implication": "Preview report before generating; show exactly what will be submitted"
      },
      "INT-004": {
        "id": "INT-004",
        "label": "Field Data Entry",
        "short": "Data entry",
        "description": "Ecology consultants enter field survey data on tablets in outdoor conditions with potential gloved interaction.",
        "connects_to": ["PSY-005", "AUD-002", "EMO-003"],
        "principle": "Data entry in adverse conditions requires large targets and immediate validation",
        "implication": "Touch targets minimum 48px, inline validation on every field",
        "phase": "active-use",
        "state": "input"
      },
      "INT-005": {
        "id": "INT-005",
        "label": "Risk Category Deep Dive",
        "short": "Category detail",
        "description": "After seeing the overall risk, users drill into specific categories (soil, species, noise, water) to understand contributing factors and required actions.",
        "connects_to": ["PSY-002", "PSY-001", "VIS-005"],
        "principle": "Progressive disclosure from summary to detail reduces cognitive overload",
        "implication": "Category pages show summary metrics first, expandable sections for detail"
      }
    },
    "psychology": {
      "PSY-001": {
        "id": "PSY-001",
        "label": "Cognitive Load Management",
        "short": "Cognitive load",
        "description": "Construction professionals process complex multi-variable environmental data under time pressure. Cognitive load must be actively managed.",
        "connects_to": ["VIS-001", "VIS-002", "VIS-005"],
        "principle": "Progressive disclosure reduces cognitive overload in data-dense environments",
        "implication": "Show summary first, details on demand. Never show all variables simultaneously.",
        "anti_pattern": "Showing all data fields on a single screen without hierarchy"
      },
      "PSY-002": {
        "id": "PSY-002",
        "label": "Visual Hierarchy for Scanning",
        "short": "Visual hierarchy",
        "description": "Users scan risk data in an F-pattern. Critical risk information must occupy the top-left quadrant and use size/color to stand out.",
        "connects_to": ["VIS-001", "VIS-003"],
        "principle": "Leverage natural F-pattern scanning for critical information placement",
        "implication": "Risk scores top-left, largest font size. Supporting data flows below and right."
      },
      "PSY-003": {
        "id": "PSY-003",
        "label": "Comparison Cognition",
        "short": "Comparison",
        "description": "Comparing multiple risk profiles requires aligned visual dimensions. Misaligned scales or layouts break comparative judgment.",
        "connects_to": ["VIS-006"],
        "principle": "Consistent encoding across compared items enables rapid judgment",
        "implication": "Project comparison cards must have identical structure, scale, and color mapping"
      },
      "PSY-004": {
        "id": "PSY-004",
        "label": "Regulatory Confidence",
        "short": "Reg. confidence",
        "description": "Submitting regulatory reports is high-stakes. Users need to feel certain the output is correct and complete before submission.",
        "connects_to": ["VIS-007", "EMO-002"],
        "principle": "Uncertainty in high-stakes actions causes paralysis",
        "implication": "Show completeness checklist and preview before report generation"
      },
      "PSY-005": {
        "id": "PSY-005",
        "label": "Error Prevention in Data Entry",
        "short": "Error prevention",
        "description": "Field data entry errors are costly to correct later. Prevent errors at input time with constraints and validation.",
        "connects_to": ["VIS-008", "A11Y-003"],
        "principle": "Prevention is cheaper than correction in field-collected data",
        "implication": "Constrained inputs (dropdowns, ranges) over free text. Inline validation."
      }
    },
    "culture": {
      "CUL-001": {
        "id": "CUL-001",
        "label": "Dutch Directness",
        "short": "Dutch directness",
        "description": "Dutch professional culture values direct, unambiguous communication. Risk labels should state the fact without hedging or euphemism.",
        "connects_to": ["VIS-003", "VIS-004"],
        "principle": "State risk directly — 'High risk' not 'Elevated concern level'",
        "implication": "Use plain Dutch risk terminology. No softening language.",
        "linguistic_examples": ["Hoog risico", "Actie vereist", "Veilig", "Niet conform"]
      },
      "CUL-002": {
        "id": "CUL-002",
        "label": "Data-Dense Professional Tools",
        "short": "Data density",
        "description": "Dutch construction professionals expect information density similar to engineering tools like AutoCAD or Revit, not consumer app spaciousness.",
        "connects_to": ["VIS-001", "VIS-002"],
        "principle": "Information density signals professionalism and respect for expertise",
        "implication": "Compact spacing, smaller body text, dense tables. Whitespace is for structure, not decoration."
      },
      "CUL-003": {
        "id": "CUL-003",
        "label": "Dutch Regulatory Formality",
        "short": "Regulatory formality",
        "description": "Dutch environmental regulations (Wet natuurbescherming, EU directives) require precise, formal documentation. Reports must match expected bureaucratic format.",
        "connects_to": ["VIS-007"],
        "principle": "Regulatory output format is non-negotiable and culturally prescribed",
        "implication": "Report layout follows Dutch regulatory conventions exactly"
      },
      "CUL-004": {
        "id": "CUL-004",
        "label": "Color Semantics in Dutch Construction",
        "short": "Color semantics",
        "description": "In Dutch construction, red/yellow/green have specific regulatory weight beyond general UX conventions. Red means stop-work, not just 'attention needed'.",
        "connects_to": ["VIS-003", "A11Y-001"],
        "principle": "Color semantics must match industry-specific regulatory meaning",
        "implication": "Red = stop/prohibited, Orange = action required, Yellow = caution, Green = proceed"
      }
    },
    "emotions": {
      "EMO-001": {
        "id": "EMO-001",
        "label": "Controlled Urgency",
        "short": "Controlled urgency",
        "description": "High-risk findings should create appropriate urgency without panic. The interface must project control even when delivering alarming data.",
        "connects_to": ["VIS-003", "VIS-004"],
        "principle": "Professional urgency through structure, not alarm",
        "implication": "Use color and prominence to signal severity, but maintain clean layout. No flashing, no exclamation marks."
      },
      "EMO-002": {
        "id": "EMO-002",
        "label": "Submission Confidence",
        "short": "Confidence",
        "description": "Users submitting regulatory reports need to feel confident the data is complete and correct. Uncertainty leads to re-checking loops.",
        "connects_to": ["VIS-007"],
        "principle": "Confidence comes from visible completeness, not reassuring language",
        "implication": "Show completion percentage, checklist of required sections, preview of final output"
      },
      "EMO-003": {
        "id": "EMO-003",
        "label": "Field Work Frustration Prevention",
        "short": "Frustration prevention",
        "description": "Data entry in field conditions (rain, cold, gloves) is inherently frustrating. The interface must minimize friction, not add to it.",
        "connects_to": ["VIS-008", "A11Y-003"],
        "principle": "Every unnecessary tap in field conditions is a frustration multiplier",
        "implication": "Minimize required taps. Auto-save. Large targets. Smart defaults."
      }
    },
    "audience": {
      "AUD-001": {
        "id": "AUD-001",